nome,nome,votos
PAULO CEZAR DE CRISTO,PAULO CEZAR DE CRISTO,1291.0
FABIO HENRIQUE DA SILVA,FABIO HENRIQUE DA SILVA,4901.000000000003
SIDENEI HORTA RIBAS,SIDENEI HORTA RIBAS,1532.9999999999998
NATHALIE LOPES MARTINS,NATHALIE LOPES MARTINS,8.000000000000002
ADRIANA VILARINHO SALOMÃO COELHO,ADRIANA VILARINHO SALOMÃO COELHO,1689.0000000000005
PAULO SERGIO VIEIRA,PAULO SERGIO VIEIRA,0.0
ADALBERTO MARCOS DE ARAUJO,ADALBERTO MARCOS DE ARAUJO,5508.0
REGIANE MICHAKI,REGIANE MICHAKI,102.99999999999999
VALDIR CARLOS FERNANDES,VALDIR CARLOS FERNANDES,1589.0000000000005
ODAIR DO PRADO,ODAIR DO PRADO,2071.9999999999995
JOSÉ MARIANO DE MACEDO,JOSÉ MARIANO DE MACEDO,340.9999999999999
RAPHAELA CRISTINA CARVALHO DA SILVA,RAPHAELA CRISTINA CARVALHO DA SILVA,3898.0000000000014
JERONIMO NEIVA NETO,JERONIMO NEIVA NETO,1573.0
ANTONIO DE CASTRO LIRA,ANTONIO DE CASTRO LIRA,2813.0000000000005
ANDRE CARLOS ALVES DE PAULA FILHO,ANDRE CARLOS ALVES DE PAULA FILHO,100874.99999999996
CARLOS EDUARDO CINTRA DA COSTA PEREIRA,CARLOS EDUARDO CINTRA DA COSTA PEREIRA,41225.99999999998
DANILO JORGE DE BARROS CABRAL,DANILO JORGE DE BARROS CABRAL,113588.00000000001
FRANCISCO TADEU BARBOSA DE ALENCAR,FRANCISCO TADEU BARBOSA DE ALENCAR,102668.99999999999
GILSON DA SILVA LIMA,GILSON DA SILVA LIMA,6139.999999999995
HEBERTE LAMARCK GOMES DA SILVA,HEBERTE LAMARCK GOMES DA SILVA,97268.99999999996
JOAO FERNANDO PONTUAL COUTINHO,JOAO FERNANDO PONTUAL COUTINHO,120059.00000000007
JOSE ROBERTO AMORIM LEANDRO,JOSE ROBERTO AMORIM LEANDRO,8042.000000000001
MARINALDO ROSENDO DE ALBUQUERQUE,MARINALDO ROSENDO DE ALBUQUERQUE,97379.99999999999
ANDERSON FERREIRA RODRIGUES,ANDERSON FERREIRA RODRIGUES,150565.00000000012
AUGUSTO RODRIGUES COUTINHO DE MELO,AUGUSTO RODRIGUES COUTINHO DE MELO,67918.00000000003
BRUNO CAVALCANTI DE ARAÚJO,BRUNO CAVALCANTI DE ARAÚJO,131767.9999999999
CLEUZA PEREIRA DO NASCIMENTO,CLEUZA PEREIRA DO NASCIMENTO,24774.999999999978
EDUARDO HENRIQUE DA FONTE DE ALBUQUERQUE SILVA,EDUARDO HENRIQUE DA FONTE DE ALBUQUERQUE SILVA,283566.9999999999
FELIPE AUGUSTO LYRA CARRERAS,FELIPE AUGUSTO LYRA CARRERAS,187347.99999999985
RAUL BELENS JUNGMANN PINTO,RAUL BELENS JUNGMANN PINTO,36866.000000000015
HORTÊNCIA SANTOS SILVA DE OLIVEIRA,HORTÊNCIA SANTOS SILVA DE OLIVEIRA,121.99999999999994
JARBAS DE ANDRADE VASCONCELOS,JARBAS DE ANDRADE VASCONCELOS,227470.0
LUCIANA BARBOSA DE OLIVEIRA SANTOS,LUCIANA BARBOSA DE OLIVEIRA SANTOS,85053.00000000007
MARIA APARECIDA OLIVEIRA DE LIMA,MARIA APARECIDA OLIVEIRA DE LIMA,100.99999999999996
SEVERINO DE SOUZA SILVA,SEVERINO DE SOUZA SILVA,21042.999999999985
ZACARIAS VILHARBA,ZACARIAS VILHARBA,11198.99999999999
DANIEL PIRES COELHO,DANIEL PIRES COELHO,138825.00000000006
JOSÉ ROBERTO TAVARES GADELHA,JOSÉ ROBERTO TAVARES GADELHA,0.0
ROBERVAL GOIS,ROBERVAL GOIS,6080.000000000001
SEBASTIAO IGNACIO DE OLIVEIRA JUNIOR,SEBASTIAO IGNACIO DE OLIVEIRA JUNIOR,115926.00000000001
EZEQUIAS LUCIANO DE OLIVEIRA,EZEQUIAS LUCIANO DE OLIVEIRA,1566.9999999999998
GUILHERME CRUZ DE SOUZA COELHO,GUILHERME CRUZ DE SOUZA COELHO,18962.000000000007
JOSEFA RENÊ SANTOS PATRIOTA,JOSEFA RENÊ SANTOS PATRIOTA,13065.000000000007
RAFAEL LUIZ PREQUÉ MOURA DE OLIVEIRA,RAFAEL LUIZ PREQUÉ MOURA DE OLIVEIRA,9090.000000000002
ELIEZER DA SILVA COSTA,ELIEZER DA SILVA COSTA,6682.999999999999
FERNANDO BEZERRA DE SOUZA COELHO FILHO,FERNANDO BEZERRA DE SOUZA COELHO FILHO,112684.0
FERNANDO MONTEIRO DE ALBUQUERQUE,FERNANDO MONTEIRO DE ALBUQUERQUE,50127.99999999997
FRANCISCO EURICO DA SILVA,FRANCISCO EURICO DA SILVA,233761.9999999998
LUIZ GONZAGA PATRIOTA,LUIZ GONZAGA PATRIOTA,101452.00000000003
ULISSES FELINTO FILHO,ULISSES FELINTO FILHO,7237.999999999994
JOSÉ MENDONÇA BEZERRA FILHO,JOSÉ MENDONÇA BEZERRA FILHO,88249.99999999997
ANA PAULA MONTEIRO DE OLIVEIRA,ANA PAULA MONTEIRO DE OLIVEIRA,335.0
CARLOS ROBERTO MAGALHAES NUMERIANO,CARLOS ROBERTO MAGALHAES NUMERIANO,3610.9999999999973
PAULO CAMELO DE HOLANDA CAVALCANTI,PAULO CAMELO DE HOLANDA CAVALCANTI,4436.000000000002
VALMIR NASCIMENTO GUERRA SILVA,VALMIR NASCIMENTO GUERRA SILVA,207.99999999999997
VLADEMIR RIBEIRO GOMES,VLADEMIR RIBEIRO GOMES,315.00000000000006
ROBERTO SANTOS DA SILVA,ROBERTO SANTOS DA SILVA,763.0000000000001
WILSON JOSE DA SILVA,WILSON JOSE DA SILVA,895.9999999999999
CLAUDOMIRA DE ANDRADE MORAIS FERREIRA,CLAUDOMIRA DE ANDRADE MORAIS FERREIRA,7616.000000000001
CRISTOVAM FERREIRA DE MELO,CRISTOVAM FERREIRA DE MELO,4101.999999999998
PAULO SAVIO DE ALMEIDA JUNIOR,PAULO SAVIO DE ALMEIDA JUNIOR,3727.000000000003
SAMUEL JOSE DE ARAUJO,SAMUEL JOSE DE ARAUJO,1616.9999999999995
MURILO VIEIRA DA SILVA,MURILO VIEIRA DA SILVA,2541.999999999999
VALMIR LUIZ DE SANTANA,VALMIR LUIZ DE SANTANA,2105.9999999999995
ANDREZA FERREIRA BURGOS,ANDREZA FERREIRA BURGOS,143.0
ARLINDO NEMESIO DE SIQUEIRA CAVALCANTI NETO,ARLINDO NEMESIO DE SIQUEIRA CAVALCANTI NETO,5777.000000000004
CARLOS ADILSON PINTO LAPA,CARLOS ADILSON PINTO LAPA,23447.99999999999
JONAS PEREIRA,JONAS PEREIRA,1320.9999999999995
LUCIANO CALDAS BIVAR,LUCIANO CALDAS BIVAR,24839.99999999999
MARCOS CAMPOS DE ALBUQUERQUE,MARCOS CAMPOS DE ALBUQUERQUE,14475.999999999989
MARIA RITA LIMA DA SILVA,MARIA RITA LIMA DA SILVA,216.00000000000003
MOISES FRANCISCO DA SILVA,MOISES FRANCISCO DA SILVA,9159.000000000007
ROGÉRIO LIMA DE LUCCA,ROGÉRIO LIMA DE LUCCA,14244.000000000011
INALDO SATILINO DE OLIVEIRA,INALDO SATILINO DE OLIVEIRA,4497.000000000004
JOSÉ BELARMINO DE SOUSA,JOSÉ BELARMINO DE SOUSA,18354.99999999999
KAIO CÉSAR DE MOURA MANIÇOBA NOVAES FERRAZ,KAIO CÉSAR DE MOURA MANIÇOBA NOVAES FERRAZ,28585.00000000001
LUIZ EDUARDO DE OLIVEIRA,LUIZ EDUARDO DE OLIVEIRA,761.0000000000002
MARILIA GABRIELLA PEDROSA DE SOUSA,MARILIA GABRIELLA PEDROSA DE SOUSA,43.99999999999999
NUNES RAFAEL MENDES COELHO,NUNES RAFAEL MENDES COELHO,16629.000000000007
RIVALDO SOARES DO NASCIMENTO,RIVALDO SOARES DO NASCIMENTO,6891.000000000001
ARMANDO JOSÉ DA SILVA FILHO,ARMANDO JOSÉ DA SILVA FILHO,5149.999999999999
JOSÉ CLEMENTINO DE AZEVEDO NETO,JOSÉ CLEMENTINO DE AZEVEDO NETO,7939.999999999998
LAELSON OLIVEIRA COSTA,LAELSON OLIVEIRA COSTA,706.9999999999999
SERGIO DE JESUS GOMES DA CUNHA,SERGIO DE JESUS GOMES DA CUNHA,412.99999999999994
ELIENE BARROS FELIPE,ELIENE BARROS FELIPE,80.00000000000003
MARIA APARECIDA MARTINS DOS SANTOS,MARIA APARECIDA MARTINS DOS SANTOS,163.99999999999994
JOSENILDO SINESIO DA SILVA,JOSENILDO SINESIO DA SILVA,20897.000000000007
JOAO DE DEUS DOS SANTOS,JOAO DE DEUS DOS SANTOS,453.00000000000017
ALBERISSON CARLOS DA SILVA,ALBERISSON CARLOS DA SILVA,14524.000000000011
JORGE WICKS CÔRTE REAL,JORGE WICKS CÔRTE REAL,86023.00000000006
MARILEIDE ROSENDO DE ALBUQUERQUE,MARILEIDE ROSENDO DE ALBUQUERQUE,251.00000000000003
ISABELLA MENEZES DE ROLDÃO FIORENZANO,ISABELLA MENEZES DE ROLDÃO FIORENZANO,33016.00000000003
WOLNEY QUEIROZ MACIEL,WOLNEY QUEIROZ MACIEL,86739.00000000001
FERNANDO DANTAS FERRO,FERNANDO DANTAS FERRO,59147.00000000003
SILVIO SERAFIM COSTA,SILVIO SERAFIM COSTA,103461.00000000001
JOSE CAVALCANTI ALVES JUNIOR,JOSE CAVALCANTI ALVES JUNIOR,97056.99999999997
ROMERO ANTONIO RAPOSO SALES,ROMERO ANTONIO RAPOSO SALES,18031.00000000001
ALDO AMARAL DE ARAUJO,ALDO AMARAL DE ARAUJO,12291.000000000005
ALINE AGOSTINHA DE BELO,ALINE AGOSTINHA DE BELO,218.00000000000003
PEDRO EUGÊNIO DE CASTRO TOLEDO CABRAL,PEDRO EUGÊNIO DE CASTRO TOLEDO CABRAL,61025.00000000001
TÚLIO GADÊLHA SALES DE MELO,TÚLIO GADÊLHA SALES DE MELO,3495.0
RICARDO TEOBALDO CAVALCANTI,RICARDO TEOBALDO CAVALCANTI,92262.0
ROBERTA KELLY RODRIGUES E SILVA,ROBERTA KELLY RODRIGUES E SILVA,14.999999999999998
ADALBERTO CAVALCANTI RODRIGUES,ADALBERTO CAVALCANTI RODRIGUES,99912.00000000004
CARLOS GERALDO SANTANA DE OLIVEIRA,CARLOS GERALDO SANTANA DE OLIVEIRA,56596.999999999985
JACQUELINE ROBERTO DE SOUZA,JACQUELINE ROBERTO DE SOUZA,116.00000000000003
DILSON DE MOURA PEIXOTO FILHO,DILSON DE MOURA PEIXOTO FILHO,38551.99999999999
JOSÉ FÁBIO FLORENTINO SILVA,JOSÉ FÁBIO FLORENTINO SILVA,3668.0000000000014
SIMONE MARIA RODRIGUES E SILVA,SIMONE MARIA RODRIGUES E SILVA,58.999999999999986
WALERIA DE ALMEIDA SILVA,WALERIA DE ALMEIDA SILVA,14.0
DAVID BATISTA SANTIAGO,DAVID BATISTA SANTIAGO,2493.0000000000005
DENISE ALMEIDA DO NASCIMENTO,DENISE ALMEIDA DO NASCIMENTO,20.0
JOÃO DA COSTA BEZERRA FILHO,JOÃO DA COSTA BEZERRA FILHO,63060.00000000006
MOZART JULIO TABOSA SALES,MOZART JULIO TABOSA SALES,73967.00000000003
EVALDO JOSÉ LOUREIRO AMORIM FILHO,EVALDO JOSÉ LOUREIRO AMORIM FILHO,246.00000000000006
MARCOS ANTONIO DA SILVA,MARCOS ANTONIO DA SILVA,1655.9999999999993
HALLYSSON FERREIRA DIAS MONTEIRO,HALLYSSON FERREIRA DIAS MONTEIRO,183.00000000000006
JULLYANE ALVES TEIXEIRA,JULLYANE ALVES TEIXEIRA,1128.9999999999995
VERÔNICA VIANA DE SOUSA,VERÔNICA VIANA DE SOUSA,1446.9999999999995
JULIA ALVES DE AQUINO,JULIA ALVES DE AQUINO,755.0000000000002
AFRANIO GOMES DE SENA,AFRANIO GOMES DE SENA,311.9999999999999
WILSON DAS CHAGAS SILVA,WILSON DAS CHAGAS SILVA,457.00000000000017
MARIA DA PURIFICAÇÃO CARVALHO LIMA DE ALENCAR,MARIA DA PURIFICAÇÃO CARVALHO LIMA DE ALENCAR,305.0
FRANCISCO OLIVEIRA DA SILVA,FRANCISCO OLIVEIRA DA SILVA,1167.0000000000002
MARCELO COSTA E CASTRO,MARCELO COSTA E CASTRO,111132.00000000006
MARLLOS ROSSANO RIBEIRO GONÇALVES DE SAMPAIO,MARLLOS ROSSANO RIBEIRO GONÇALVES DE SAMPAIO,77230.00000000004
HUGO NAPOLEÃO DO REGO NETO,HUGO NAPOLEÃO DO REGO NETO,59977.00000000002
JULIO CESAR DE CARVALHO LIMA,JULIO CESAR DE CARVALHO LIMA,99750.00000000007
SEMIRAMES DE GUADALUPE MOTA SOUSA,SEMIRAMES DE GUADALUPE MOTA SOUSA,299.9999999999999
FLAVIO RODRIGUES NOGUEIRA,FLAVIO RODRIGUES NOGUEIRA,88764.99999999993
JOSE HILMAR GOMES DA SILVA,JOSE HILMAR GOMES DA SILVA,1483.0
CARLA SOARES SANTOS,CARLA SOARES SANTOS,1004.0000000000001
IDONEIL SANTANA MESQUITA,IDONEIL SANTANA MESQUITA,21553.000000000015
OSMAR RIBEIRO DE ALMEIDA JÚNIOR,OSMAR RIBEIRO DE ALMEIDA JÚNIOR,69705.00000000003
ATILA FREITAS LIRA,ATILA FREITAS LIRA,129275.99999999991
HERACLITO DE SOUSA FORTES,HERACLITO DE SOUSA FORTES,90898.00000000004
JOSE GERALDO ALENCAR FILHO,JOSE GERALDO ALENCAR FILHO,2478.999999999999
RODRIGO RODRIGUES DE SOUZA MARTINS,RODRIGO RODRIGUES DE SOUZA MARTINS,92348.99999999994
JOSE MILTON DA SILVA,JOSE MILTON DA SILVA,581.9999999999999
THUYLA KAYNARA DE OLIVEIRA MARTINS,THUYLA KAYNARA DE OLIVEIRA MARTINS,150.0
ANTONIO ALMEIDA DE SOUSA,ANTONIO ALMEIDA DE SOUSA,1265.9999999999995
RAIMUNDA NONATA GOMES,RAIMUNDA NONATA GOMES,934.0000000000003
CELSO HENRIQUE BARBOSA LIMA,CELSO HENRIQUE BARBOSA LIMA,2475.0000000000005
FILINTRO LURA DE SÁ NETO,FILINTRO LURA DE SÁ NETO,265.0
EDINA CRUZ DE SOUSA LIMA,EDINA CRUZ DE SOUSA LIMA,624.9999999999999
CARIOLANDO PEREIRA DE FRANÇA,CARIOLANDO PEREIRA DE FRANÇA,1042.0000000000002
FAUSTO LUIZ DUARTE RIPARDO,FAUSTO LUIZ DUARTE RIPARDO,141.00000000000003
EDILSON NETE RODRIGUES SANTOS,EDILSON NETE RODRIGUES SANTOS,460.9999999999999
FRANCISCO DAS CHAGAS MENDES DA SILVA,FRANCISCO DAS CHAGAS MENDES DA SILVA,662.0
MARIA MADALENA NUNES,MARIA MADALENA NUNES,1339.0
GILBERTO DA PAIXÃO FONSECA,GILBERTO DA PAIXÃO FONSECA,10464.000000000007
FRANCISCO DE ASSIS CARVALHO GONÇALVES,FRANCISCO DE ASSIS CARVALHO GONÇALVES,94093.00000000006
MERLONG SOLANO NOGUEIRA,MERLONG SOLANO NOGUEIRA,45824.0
EDILBERTO BORGES DE OLIVEIRA,EDILBERTO BORGES DE OLIVEIRA,7624.000000000004
REJANE RIBEIRO SOUSA DIAS,REJANE RIBEIRO SOUSA DIAS,134156.99999999997
JOSÉ DE ANDRADE MAIA FILHO,JOSÉ DE ANDRADE MAIA FILHO,30418.999999999975
ELIANE TEREZINHA QUEIROGA MOREIRA,ELIANE TEREZINHA QUEIROGA MOREIRA,685.9999999999998
FÁBIO ABREU COSTA,FÁBIO ABREU COSTA,80838.99999999999
JOSÉ FRANCISCO PAES LANDIM,JOSÉ FRANCISCO PAES LANDIM,82548.99999999999
JOVENILIA ALVES DE OLIVEIRA MONTEIRO,JOVENILIA ALVES DE OLIVEIRA MONTEIRO,15664.000000000005
RAIMUNDO ALCEMIR DA SILVA,RAIMUNDO ALCEMIR DA SILVA,298.0000000000001
VALMIR PAZ GIL,VALMIR PAZ GIL,320.0
IRACEMA MARIA PORTELLA NUNES NOGUEIRA LIMA,IRACEMA MARIA PORTELLA NUNES NOGUEIRA LIMA,121120.99999999997
CARLOS HENRIQUE DE FREITAS ROCHA,CARLOS HENRIQUE DE FREITAS ROCHA,1141.0000000000005
EDILSON DA COSTA ARAUJO,EDILSON DA COSTA ARAUJO,1751.9999999999998
EVA GOMES DA SILVA,EVA GOMES DA SILVA,32.0
FRANCISCO HILTON NASCIMENTO,FRANCISCO HILTON NASCIMENTO,208.99999999999994
GONÇALO MANOEL DA SILVA,GONÇALO MANOEL DA SILVA,3340.0000000000023
MARTA MARIA DE ARAÚJO DA SILVA,MARTA MARIA DE ARAÚJO DA SILVA,154.00000000000003
SAMIO FALCAO MENDES,SAMIO FALCAO MENDES,2455.0
HEITOR HUGO SANTOS DE ALMONDES,HEITOR HUGO SANTOS DE ALMONDES,1911.9999999999998
LAECIO DE SOUSA BORGES,LAECIO DE SOUSA BORGES,0.0
NAZAMARA BORGES RESENDE,NAZAMARA BORGES RESENDE,328.0
NIXON DÁRIO LAGES TELES DE OLIVEIRA,NIXON DÁRIO LAGES TELES DE OLIVEIRA,453.00000000000017
ROMILDO MACÊDO MAFRA,ROMILDO MACÊDO MAFRA,1899.0000000000005
ANA LETICIA LEMOS PEDREIRA ALVARENGA,ANA LETICIA LEMOS PEDREIRA ALVARENGA,1075.0000000000002
ALEXANDRE JOSÉ SÁ DE OLIVEIRA,ALEXANDRE JOSÉ SÁ DE OLIVEIRA,417.9999999999999
ALICE LOPES DE ANDRADE E SILVA LEBRE,ALICE LOPES DE ANDRADE E SILVA LEBRE,885.0000000000001
CLEOPLÍNIO DIAS DA SILVA,CLEOPLÍNIO DIAS DA SILVA,586.0000000000002
LINDOMAR GERVÁSIO DE SOUSA,LINDOMAR GERVÁSIO DE SOUSA,419.9999999999999
MARIA DE JESUS SILVA,MARIA DE JESUS SILVA,828.0000000000001
ALLAN KARDEK DE OLIVEIRA ARAÚJO,ALLAN KARDEK DE OLIVEIRA ARAÚJO,489.9999999999999
ANTONIO FRANCISCO GOMES DE CASTRO,ANTONIO FRANCISCO GOMES DE CASTRO,651.0000000000001
JOSÉ DE RIBAMAR DE SOUSA ROCHA,JOSÉ DE RIBAMAR DE SOUSA ROCHA,321.99999999999994
SILAS FREIRE PEREIRA E SILVA,SILAS FREIRE PEREIRA E SILVA,75595.99999999999
JOSE REINALDO DA SILVA,JOSE REINALDO DA SILVA,2141.0
ANTONIO DE PADUA DO REGO MONTEIRO,ANTONIO DE PADUA DO REGO MONTEIRO,96.0
ROQUE CARVALHO LAGES,ROQUE CARVALHO LAGES,658.0
FRANCISCO ALEXANDRE BRANDÃO CARDOSO,FRANCISCO ALEXANDRE BRANDÃO CARDOSO,533.0000000000001
AURICELIA SOUSA OLIVEIRA,AURICELIA SOUSA OLIVEIRA,166.00000000000006
CRHISTIANE LOURDES DE OLIVEIRA MACÊDO,CRHISTIANE LOURDES DE OLIVEIRA MACÊDO,172.00000000000006
RITA DE CÁSSIA FERREIRA DE SOUSA,RITA DE CÁSSIA FERREIRA DE SOUSA,210.99999999999997
DIANA REIS LIMA DA CUNHA,DIANA REIS LIMA DA CUNHA,9.000000000000002
CYRO GARCIA,CYRO GARCIA,8737.000000000004
MATEUS RIBEIRO CAMPOS,MATEUS RIBEIRO CAMPOS,992.0000000000003
TICYANE MADEIRA CAVALCANTI,TICYANE MADEIRA CAVALCANTI,0.0
ANDRÉ LUÍS DE CARVALHO RODRIGUES,ANDRÉ LUÍS DE CARVALHO RODRIGUES,0.0
ANTONIO JORGE FILIPE BRAGA FILHO,ANTONIO JORGE FILIPE BRAGA FILHO,364.0
RODRIGO GOMES MARTINS ANDRADE,RODRIGO GOMES MARTINS ANDRADE,107.00000000000003
MICHELLE RODRIGUES DE MORAES,MICHELLE RODRIGUES DE MORAES,134.00000000000003
ALEXANDRE MAGNO GONZALEZ DE LACERDA,ALEXANDRE MAGNO GONZALEZ DE LACERDA,927.9999999999997
CAIO CESAR ANDRADE BEZERRA DA SILVA,CAIO CESAR ANDRADE BEZERRA DA SILVA,1418.0
GENOBRE GOMES LIMA,GENOBRE GOMES LIMA,0.0
VALMIRIA GUIDA CARDOSO,VALMIRIA GUIDA CARDOSO,314.0
NATHÁLIA MOZER REIS,NATHÁLIA MOZER REIS,37.99999999999999
ANA RACHEL SOARES COÊLHO,ANA RACHEL SOARES COÊLHO,0.0
FERNANDA FORTINI MACHARET,FERNANDA FORTINI MACHARET,0.0
MARCELO DE SOUZA LESSA,MARCELO DE SOUZA LESSA,7964.000000000004
LUCIO ROSA,LUCIO ROSA,434.00000000000006
ALEX BERALDO ROCHA,ALEX BERALDO ROCHA,14954.000000000005
VALÉRIA DE OLIVEIRA SILVA MARTINS,VALÉRIA DE OLIVEIRA SILVA MARTINS,636.9999999999999
AMANDO GOMES DE AMORIM,AMANDO GOMES DE AMORIM,828.0000000000001
ALAN SILVA DOS SANTOS,ALAN SILVA DOS SANTOS,5041.999999999998
ADRIANO DA SILVA GUEDES,ADRIANO DA SILVA GUEDES,5057.999999999999
ANDRÉ DE OLIVEIRA,ANDRÉ DE OLIVEIRA,0.0
MARIA ANTONIETA DOS SANTOS,MARIA ANTONIETA DOS SANTOS,446.9999999999999
MARCOS FERREIRA DE LIMA,MARCOS FERREIRA DE LIMA,6749.9999999999945
ROBERTO CARLOS RODRIGUES,ROBERTO CARLOS RODRIGUES,2248.0
RODRIGO DAS NEVES FERNANDES,RODRIGO DAS NEVES FERNANDES,844.9999999999998
WELLINGTON JOSÉ DA SILVA,WELLINGTON JOSÉ DA SILVA,4809.000000000001
LUIZ ERNANI ALVES LACAILLE CALDAS,LUIZ ERNANI ALVES LACAILLE CALDAS,2169.000000000001
ZORAIA CORREA GOMES,ZORAIA CORREA GOMES,210.00000000000003
JONATAN FRANCISCO DOS SANTOS,JONATAN FRANCISCO DOS SANTOS,253.99999999999991
JOADIL RAPOSO MENDONÇA,JOADIL RAPOSO MENDONÇA,1014.0
JONAS DE OLIVEIRA,JONAS DE OLIVEIRA,0.0
JOÃO DIAS,JOÃO DIAS,3105.0000000000023
JORGE HENRIQUE DA COSTA NUNES,JORGE HENRIQUE DA COSTA NUNES,14786.000000000005
JEFERSON EVANGELISTA CORREA,JEFERSON EVANGELISTA CORREA,3254.9999999999995
ALAN LIMA DE ALMEIDA MELLO,ALAN LIMA DE ALMEIDA MELLO,1343.0000000000002
ANATÁLIA DOS SANTOS,ANATÁLIA DOS SANTOS,421.0000000000001
ANDRE AFONSO SILVA,ANDRE AFONSO SILVA,1305.0
ANDRÉIA REBELLO MATTOS,ANDRÉIA REBELLO MATTOS,109.99999999999997
ANTONIO MANOEL DE SOUZA,ANTONIO MANOEL DE SOUZA,23411.99999999999
ATILA ALEXANDRE NUNES PEREIRA,ATILA ALEXANDRE NUNES PEREIRA,27374.000000000015
BRAZ PAULINO DA SILVA,BRAZ PAULINO DA SILVA,1230.9999999999998
CARLOS ALBERTO HERMÍNIO DE MORAES,CARLOS ALBERTO HERMÍNIO DE MORAES,1981.9999999999998
CARLOS EDUARDO INACIO RIBEIRO,CARLOS EDUARDO INACIO RIBEIRO,1259.0000000000002
CLOVIS JOSE PASSOS FILHO,CLOVIS JOSE PASSOS FILHO,6443.999999999998
CRISTIANE RODRIGUES GUEDES,CRISTIANE RODRIGUES GUEDES,10687.0
EDNA SILVA DE LIMA,EDNA SILVA DE LIMA,305.9999999999999
ELOIZANETH ALVES FRASSETTI,ELOIZANETH ALVES FRASSETTI,1246.0
GILBERTO DE ATAIDE BARROSO,GILBERTO DE ATAIDE BARROSO,185.00000000000009
IGUARACIRA DE JESUS SANTOS MARINHO,IGUARACIRA DE JESUS SANTOS MARINHO,0.0
IRVAIR BRANDÃO DE SOUZA,IRVAIR BRANDÃO DE SOUZA,539.9999999999998
JORGE FERREIRA CAMPOS,JORGE FERREIRA CAMPOS,10511.999999999993
JÚLIO ALVES GÓES,JÚLIO ALVES GÓES,11201.99999999999
LAYDSON CARLOS DE SOUZA CRUZ,LAYDSON CARLOS DE SOUZA CRUZ,9537.999999999995
MARCELINO FRANCISCO SOARES,MARCELINO FRANCISCO SOARES,220.99999999999997
MARCOS ANTONIO CANDIDO MANSO,MARCOS ANTONIO CANDIDO MANSO,215.00000000000006
MARTINHO LUTERO PEREIRA MONTEIRO,MARTINHO LUTERO PEREIRA MONTEIRO,6657.999999999995
MICHELE AURORA CALDAS,MICHELE AURORA CALDAS,5.0
PATRÍCIA CARVALHO FALCÃO,PATRÍCIA CARVALHO FALCÃO,0.0
PEDRO CHAVARRY DUARTE,PEDRO CHAVARRY DUARTE,1947.9999999999998
FERNANDO DA SILVA FERNANDES,FERNANDO DA SILVA FERNANDES,0.0
EDSON SILVA DE OLIVEIRA,EDSON SILVA DE OLIVEIRA,0.0
ATHAYDE GOMES DE LUCENA,ATHAYDE GOMES DE LUCENA,848.0000000000003
GEISO PEREIRA TURQUES,GEISO PEREIRA TURQUES,8086.000000000005
CHRISTIANO PEREIRA HUGUENIN,CHRISTIANO PEREIRA HUGUENIN,4080.0000000000036
INGRID MERENDA NOBRE GIRÃO,INGRID MERENDA NOBRE GIRÃO,1481.9999999999995
AUREO LIDIO MOREIRA RIBEIRO,AUREO LIDIO MOREIRA RIBEIRO,58117.00000000003
CAROLINA VIANNA GUIMARAES BARROS,CAROLINA VIANNA GUIMARAES BARROS,755.9999999999998
ISAIAS DE OLIVEIRA,ISAIAS DE OLIVEIRA,0.0
ANDREI LARA SOARES,ANDREI LARA SOARES,2557.999999999999
ANTONIO CARLOS DA SILVA PASSOS,ANTONIO CARLOS DA SILVA PASSOS,2145.0000000000005
EZEQUIEL CORTAZ TEIXEIRA,EZEQUIEL CORTAZ TEIXEIRA,35701.00000000001
LEONARDO FRANCO PEREIRA,LEONARDO FRANCO PEREIRA,17036.999999999996
ELNORA CASTRO SOARES NASCIMENTO DA COSTA E SILVA,ELNORA CASTRO SOARES NASCIMENTO DA COSTA E SILVA,840.0000000000002
RICARDO DE SOUZA COSTA,RICARDO DE SOUZA COSTA,8708.999999999995
ABEL DE PAULA E SILVA SEGUNDO,ABEL DE PAULA E SILVA SEGUNDO,4328.999999999996
FRANCISCO RODRIGUES DE ALENCAR FILHO,FRANCISCO RODRIGUES DE ALENCAR FILHO,195963.99999999985
JEAN WYLLYS DE MATOS SANTOS,JEAN WYLLYS DE MATOS SANTOS,144769.9999999999
DERLI CIPRIANO VALIÃO DO NASCIMENTO,DERLI CIPRIANO VALIÃO DO NASCIMENTO,168.0
WENDERSON DIAS RIBEIRO,WENDERSON DIAS RIBEIRO,1048.0
MARCIO FERREIRA LAMEIRA,MARCIO FERREIRA LAMEIRA,438.99999999999983
IVANILDO FELIX CANDIDO,IVANILDO FELIX CANDIDO,555.0
VERACI AUGUSTO ARCANJO,VERACI AUGUSTO ARCANJO,833.0000000000001
VALDINEI MEDINA MACHADO,VALDINEI MEDINA MACHADO,0.0
FRANCISCO DE PAULA DOS REIS LIMA,FRANCISCO DE PAULA DOS REIS LIMA,974.0000000000001
WILSON FERNANDES PEREIRA,WILSON FERNANDES PEREIRA,1033.9999999999998
ADRIANA RODRIGUES DE OLIVEIRA,ADRIANA RODRIGUES DE OLIVEIRA,715.0000000000001
ALEX PIMENTA BENTO,ALEX PIMENTA BENTO,1980.0000000000005
FABIANO DE SOUZA VIEIRA,FABIANO DE SOUZA VIEIRA,1237.9999999999998
JACQUELINE MELO DA MATA FIGUEIREDO,JACQUELINE MELO DA MATA FIGUEIREDO,451.00000000000017
LOURDES BAPTISTA DA SILVA,LOURDES BAPTISTA DA SILVA,100.00000000000003
PAULO EDUARDO GOMES,PAULO EDUARDO GOMES,23410.00000000001
RENATO ATHAYDE SILVA,RENATO ATHAYDE SILVA,27964.999999999993
VALMIR DE CARVALHO FARIA,VALMIR DE CARVALHO FARIA,607.0000000000001
JANE ALVES DE OLIVEIRA,JANE ALVES DE OLIVEIRA,1262.0
DENISE PEREIRA DO NASCIMENTO,DENISE PEREIRA DO NASCIMENTO,760.0000000000002
RONALDO LUIZ GOMES,RONALDO LUIZ GOMES,0.0
DARCY BERNARDO FILHO,DARCY BERNARDO FILHO,355.0
SOLANGE DOS SANTOS PACHECO,SOLANGE DOS SANTOS PACHECO,724.0
ANA PAULA DE SOUZA RODRIGUES,ANA PAULA DE SOUZA RODRIGUES,174.99999999999991
BEATRICE MILLER CORDOEIRA,BEATRICE MILLER CORDOEIRA,550.0000000000002
NILSON RODRIGUES ALVES,NILSON RODRIGUES ALVES,1167.0000000000002
EDUARDO DE ALMEIDA SANTOS,EDUARDO DE ALMEIDA SANTOS,708.0
RAMON VIEIRA FAUSTO,RAMON VIEIRA FAUSTO,3237.0000000000014
ADENILSON JOSÉ MESSIAS,ADENILSON JOSÉ MESSIAS,806.0000000000002
BENEVENUTO DACIOLO FONSECA DOS SANTOS,BENEVENUTO DACIOLO FONSECA DOS SANTOS,49831.000000000015
ERONILDO MEZINI FERREIRA,ERONILDO MEZINI FERREIRA,2691.9999999999995
SANDRO SABINO SAAR LISBOA,SANDRO SABINO SAAR LISBOA,3672.9999999999986
EDMILSON RIBEIRO GOMES,EDMILSON RIBEIRO GOMES,1398.9999999999998
RICARDO CESAR TEIXEIRA PESSANHA,RICARDO CESAR TEIXEIRA PESSANHA,440.0
MARCELO AMARAL CARNEIRO,MARCELO AMARAL CARNEIRO,14966.0
JOSEMILTON MAURICIO DA COSTA,JOSEMILTON MAURICIO DA COSTA,1998.9999999999998
MARCUS VINÍCIUS DE OLIVEIRA PINTO,MARCUS VINÍCIUS DE OLIVEIRA PINTO,21598.000000000007
WILSON SIMÕES LUZ,WILSON SIMÕES LUZ,180.99999999999997
FABIANO TAQUES HORTA,FABIANO TAQUES HORTA,37988.999999999985
ALBERTO LUIZ VIEIRA COSTA,ALBERTO LUIZ VIEIRA COSTA,2519.000000000001
MARLOS LUIZ DE ARAUJO COSTA,MARLOS LUIZ DE ARAUJO COSTA,19808.000000000015
PEDRO GEROLIMICH DE ABREU,PEDRO GEROLIMICH DE ABREU,4044.0000000000023
FRANCISCO JOSÉ D'ANGELO PINTO,FRANCISCO JOSÉ D'ANGELO PINTO,52809.0
LUIZ SERGIO NÓBREGA DE OLIVEIRA,LUIZ SERGIO NÓBREGA DE OLIVEIRA,48903.0
CLÁUDIO HENRIQUE DOS ANJOS,CLÁUDIO HENRIQUE DOS ANJOS,2085.0000000000005
ANDRÉ TAFFAREL INÁCIO DOS SANTOS,ANDRÉ TAFFAREL INÁCIO DOS SANTOS,4199.0
MARCELO BORGES SERENO,MARCELO BORGES SERENO,24628.0
DANILO FUNKE LEME,DANILO FUNKE LEME,20371.999999999996
EDSON SANTOS DE SOUZA,EDSON SANTOS DE SOUZA,18949.999999999985
ANDRE JOSÉ DA CRUZ,ANDRE JOSÉ DA CRUZ,2586.000000000001
MARIA LUCIA COSTA SILVA,MARIA LUCIA COSTA SILVA,1148.0
ALESSANDRO LUCCIOLA MOLON,ALESSANDRO LUCCIOLA MOLON,87003.00000000006
ALAN JOSE DA SILVA,ALAN JOSE DA SILVA,7311.9999999999945
JORGE RICARDO BITTAR,JORGE RICARDO BITTAR,30592.000000000025
WADIH NEMER DAMOUS FILHO,WADIH NEMER DAMOUS FILHO,37813.99999999998
ANA LUCIA RAMALHO PACHECO,ANA LUCIA RAMALHO PACHECO,1152.0
LUCIANO HENRIQUE PEREIRA,LUCIANO HENRIQUE PEREIRA,6773.000000000001
BENEDITA SOUZA DA SILVA SAMPAIO,BENEDITA SOUZA DA SILVA SAMPAIO,48163.000000000044
JEANNE D ARC FERNANDES GUEDES,JEANNE D ARC FERNANDES GUEDES,328.0
SYLVIA DANIELLA PEREIRA AZEVEDO,SYLVIA DANIELLA PEREIRA AZEVEDO,200.0
NILSON VIANA CESÁRIO,NILSON VIANA CESÁRIO,2330.0000000000005
LUZIA SILVA DE BARROS,LUZIA SILVA DE BARROS,102.99999999999999
MAKHOUL MOUSSALLEM,MAKHOUL MOUSSALLEM,16666.000000000015
PAULO CESAR EZEQUIEL DA SILVA,PAULO CESAR EZEQUIEL DA SILVA,1124.0000000000002
LUIS FELIPE DELGADO DIAS,LUIS FELIPE DELGADO DIAS,1201.9999999999995
ROSANA DA SILVA,ROSANA DA SILVA,9881.000000000005
JANDIRA FEGHALI,JANDIRA FEGHALI,68531.00000000001
CARLOS FREDERICO KOHLER,CARLOS FREDERICO KOHLER,0.0
FERNANDO GOMES CID,FERNANDO GOMES CID,10418.000000000002
LILIA VOGEL DE CASTILHO,LILIA VOGEL DE CASTILHO,3135.0000000000027
MARIA APARECIDA RUFINO MADUREIRA,MARIA APARECIDA RUFINO MADUREIRA,790.0000000000003
DILSON MALHEIROS DRUMOND,DILSON MALHEIROS DRUMOND,35463.00000000003
RENATO DE OLIVEIRA BONDIM,RENATO DE OLIVEIRA BONDIM,1215.0000000000005
ALVARO ADERALDO CHAVES FILHO,ALVARO ADERALDO CHAVES FILHO,3166.999999999998
ALESSANDRO GOMES DE SOUZA,ALESSANDRO GOMES DE SOUZA,739.9999999999998
RODEVAL PIMENTEL DE BRITO,RODEVAL PIMENTEL DE BRITO,257.9999999999999
ANTONIO CARLOS SALES DA SILVA,ANTONIO CARLOS SALES DA SILVA,1007.9999999999995
BIANCA RODRIGUES MOTTA HERCULANO,BIANCA RODRIGUES MOTTA HERCULANO,485.99999999999994
MARLI TEODORO CUMMINGS,MARLI TEODORO CUMMINGS,499.9999999999999
JOÃO CARLOS LOPES DE ARAÚJO,JOÃO CARLOS LOPES DE ARAÚJO,596.9999999999998
CLÁUDIO FRID PATRICIO,CLÁUDIO FRID PATRICIO,434.99999999999994
PEDRO DELARUE TOLENTINO FILHO,PEDRO DELARUE TOLENTINO FILHO,5174.000000000005
MARCO ANTONIO DE LIMA FIGUEIREDO,MARCO ANTONIO DE LIMA FIGUEIREDO,2223.0
CELSO DE SOUZA ANDRADE,CELSO DE SOUZA ANDRADE,899.9999999999998
MARLUS COUTINHO SUHET,MARLUS COUTINHO SUHET,3014.0000000000014
AMARO LUIZ ALVES DA SILVA,AMARO LUIZ ALVES DA SILVA,6917.000000000002
CARLOS HENRIQUE BATISTA VAZ,CARLOS HENRIQUE BATISTA VAZ,1025.0
RADAMÉS LATTARI FILHO,RADAMÉS LATTARI FILHO,5745.000000000001
GLAUBER DE MEDEIROS BRAGA,GLAUBER DE MEDEIROS BRAGA,82235.99999999997
GUSTAVO SILVA FERREIRA,GUSTAVO SILVA FERREIRA,1510.9999999999993
CÉSAR GOMES LEAL,CÉSAR GOMES LEAL,1042.0000000000002
MARIA DAS GRAÇAS MARINS DA SILVA,MARIA DAS GRAÇAS MARINS DA SILVA,1141.0000000000005
GLEYDS VASCONCELOS DA ROCHA,GLEYDS VASCONCELOS DA ROCHA,800.0000000000003
TANIA CRISTINA LUCAS GUIMARÃES,TANIA CRISTINA LUCAS GUIMARÃES,346.00000000000006
ARMANDO DA SILVA CARNEIRO,ARMANDO DA SILVA CARNEIRO,511.9999999999999
HEVELYNE MACHADO DE SIQUEIRA,HEVELYNE MACHADO DE SIQUEIRA,298.0000000000001
ELSON RODRIGUES DA SILVA,ELSON RODRIGUES DA SILVA,675.0000000000001
ALAILTON DOS REIS GUARALDE,ALAILTON DOS REIS GUARALDE,535.0
ANDRÉ VANCE,ANDRÉ VANCE,3598.0000000000014
AUGUSTO CÉSAR DE AVELLAR FILHO,AUGUSTO CÉSAR DE AVELLAR FILHO,2467.000000000001
BENEDITO LIMA,BENEDITO LIMA,974.0000000000001
