nome,nome,votos
EMERSON DA SILVA SANTOS,EMERSON DA SILVA SANTOS,36.99999999999999
GERALDO SILVA DOS SANTOS,GERALDO SILVA DOS SANTOS,383.0
CARLOS CESAR CORREIA DE MESSIAS,CARLOS CESAR CORREIA DE MESSIAS,26448.000000000007
IDESIO LUIS FRANKE,IDESIO LUIS FRANKE,9895.999999999998
LEONARDO CUNHA DE BRITO,LEONARDO CUNHA DE BRITO,20875.999999999993
MARCELO FEITOSA DE ARAÚJO,MARCELO FEITOSA DE ARAÚJO,1025.0
RAIMUNDO ANGELIM VASCONCELOS,RAIMUNDO ANGELIM VASCONCELOS,39843.99999999999
RAMAO VIEIRA DE OLIVEIRA,RAMAO VIEIRA DE OLIVEIRA,1994.0000000000007
REGINA AMELIA D ALENCAR LINO,REGINA AMELIA D ALENCAR LINO,3842.0
ROSELI COSTA,ROSELI COSTA,1913.0000000000005
SEBASTIÃO SIBÁ MACHADO OLIVEIRA,SEBASTIÃO SIBÁ MACHADO OLIVEIRA,18395.000000000015
MOISES DINIZ LIMA,MOISES DINIZ LIMA,13738.0
ALAN RICK MIRANDA,ALAN RICK MIRANDA,17902.999999999985
JUAREZ PEDROSA CAVALCANTE,JUAREZ PEDROSA CAVALCANTE,515.0
RAIMUNDO VAZ DE AZEVEDO,RAIMUNDO VAZ DE AZEVEDO,11229.0
JOSÉ LUIS SCHAFER,JOSÉ LUIS SCHAFER,11397.00000000001
FRANCE SPYM PINTRO SOSTER,FRANCE SPYM PINTRO SOSTER,5870.999999999999
JOSE AFONSO VASCONCELOS FERNADES,JOSE AFONSO VASCONCELOS FERNADES,3343.000000000001
FRANCISCO ANTONIO LIRA DA SILVA MONTEIRO,FRANCISCO ANTONIO LIRA DA SILVA MONTEIRO,665.0000000000001
HILÁRIO JOSÉ DO NASCIMENTO,HILÁRIO JOSÉ DO NASCIMENTO,837.9999999999998
MARIA JOICILENE SOUZA SILVA NOBRE,MARIA JOICILENE SOUZA SILVA NOBRE,1199.0
SHIRLEY TORRES DE ARAÚJO,SHIRLEY TORRES DE ARAÚJO,1377.0000000000002
VALDETE DE SOUZA,VALDETE DE SOUZA,668.0000000000002
FRANCISCO CARLOS OLIVEIRA DE LIMA,FRANCISCO CARLOS OLIVEIRA DE LIMA,10306.0
JOAQUIM LIRA DE CARVALHO,JOAQUIM LIRA DE CARVALHO,962.0000000000002
JOSÉ AUGUSTO LEANDRO RODRIGUES,JOSÉ AUGUSTO LEANDRO RODRIGUES,2011.0000000000005
MARIA TERESA GAUNA,MARIA TERESA GAUNA,145.0
NORMANDO RODRIGUES SALES,NORMANDO RODRIGUES SALES,6450.999999999997
MARIA SOCORRO SOARES DE OLIVEIRA,MARIA SOCORRO SOARES DE OLIVEIRA,662.9999999999998
SAULO DE FREITAS RIBEIRO,SAULO DE FREITAS RIBEIRO,525.0000000000001
SEBASTIÃO ALVES RODRIGUES MANCHINERY,SEBASTIÃO ALVES RODRIGUES MANCHINERY,1135.0000000000005
DEODATO NUNES DE FRANÇA,DEODATO NUNES DE FRANÇA,3487.0000000000005
FRANCISCO CARLOS OLIVEIRA DA CRUZ,FRANCISCO CARLOS OLIVEIRA DA CRUZ,1153.9999999999998
MARFIZA DE LIMA GALVÃO,MARFIZA DE LIMA GALVÃO,17300.000000000004
WHERLES FERNANDES DA ROCHA,WHERLES FERNANDES DA ROCHA,23466.000000000015
EDSON BRAGA RODRIGUES,EDSON BRAGA RODRIGUES,4518.000000000003
JOSÉ VIEIRA DE FARIAS,JOSÉ VIEIRA DE FARIAS,4104.000000000003
FRANCISCO NAZARENO DA SILVA,FRANCISCO NAZARENO DA SILVA,923.9999999999998
LUIZETE SILVA E SILVA,LUIZETE SILVA E SILVA,227.00000000000006
MARIA NAZARE PEREIRA LIMA DE CARVALHO,MARIA NAZARE PEREIRA LIMA DE CARVALHO,244.99999999999991
FLAVIANO FLÁVIO BAPTISTA DE MELO,FLAVIANO FLÁVIO BAPTISTA DE MELO,18371.999999999993
ANTÔNIA LUCILEIA CRUZ RAMOS CÂMARA,ANTÔNIA LUCILEIA CRUZ RAMOS CÂMARA,12126.0
VANDA DENIR MILANI NOGUEIRA,VANDA DENIR MILANI NOGUEIRA,13610.000000000007
ILDERLEI SOUZA RODRIGUES CORDEIRO,ILDERLEI SOUZA RODRIGUES CORDEIRO,13431.000000000002
OSVALDO ALVES RIBEIRO NETO,OSVALDO ALVES RIBEIRO NETO,6707.000000000003
JOSÉ RIBAMAR COSTA,JOSÉ RIBAMAR COSTA,2354.0
CLAUDENOR MAGALHÃES SANTANA DE SOUZA,CLAUDENOR MAGALHÃES SANTANA DE SOUZA,205.99999999999994
LEILANE RIBEIRO DE OLIVEIRA,LEILANE RIBEIRO DE OLIVEIRA,2866.0
JOSE AUGUSTO BATISTA DE AGUIAR,JOSE AUGUSTO BATISTA DE AGUIAR,205.00000000000003
RUY MEDEIROS DE ARAÚJO BIRICO,RUY MEDEIROS DE ARAÚJO BIRICO,956.0000000000001
LUIZ ANUTE DOS SANTOS,LUIZ ANUTE DOS SANTOS,4717.0
ANA PAULA MORAIS DE HOLANDA,ANA PAULA MORAIS DE HOLANDA,14.999999999999998
JÉSSICA ROJAS SALES,JÉSSICA ROJAS SALES,20339.000000000007
PAULO ROBERTO CHAGAS SANTOS,PAULO ROBERTO CHAGAS SANTOS,1755.0000000000007
JOSÉ JÚNIOR NASCIMENTO SILVA,JOSÉ JÚNIOR NASCIMENTO SILVA,997.0000000000002
PAULO SÉRGIO DA SILVA FALCÃO,PAULO SÉRGIO DA SILVA FALCÃO,1751.9999999999998
VALBERTSON DE BRITO LYRA SANTOS,VALBERTSON DE BRITO LYRA SANTOS,2573.000000000001
MARIA DA GLÓRIA SANTOS OLIVEIRA,MARIA DA GLÓRIA SANTOS OLIVEIRA,109.00000000000004
JOSE CICERO SOARES DE ALMEIDA,JOSE CICERO SOARES DE ALMEIDA,64434.99999999996
AUDIVAL AMÉLIO DA SILVA NETO,AUDIVAL AMÉLIO DA SILVA NETO,58094.99999999999
JOSE BARBOSA LIMEIRA,JOSE BARBOSA LIMEIRA,12194.0
JOSIVAL FERREIRA DE LIMA,JOSIVAL FERREIRA DE LIMA,7188.000000000005
JOSE SALUSTIANO DOS SANTOS FILHO,JOSE SALUSTIANO DOS SANTOS FILHO,2349.0000000000005
MARIA SILVANA RODRIGUES SOARES,MARIA SILVANA RODRIGUES SOARES,116.00000000000003
ILDO RAFAEL DE VASCONCELOS,ILDO RAFAEL DE VASCONCELOS,3782.0000000000027
PAULA CAVALCANTE AMELIO SILVA,PAULA CAVALCANTE AMELIO SILVA,20.0
LUIZ ALBERTO ALVES TEIXEIRA,LUIZ ALBERTO ALVES TEIXEIRA,4568.000000000003
ANTONIO CARLOS AZEVEDO LESSA,ANTONIO CARLOS AZEVEDO LESSA,7464.000000000001
MARCELO ALVES DA SILVA,MARCELO ALVES DA SILVA,507.9999999999999
SERGIO CABRAL BARBOSA,SERGIO CABRAL BARBOSA,1045.0000000000005
SONIA MARIA TEIXEIRA SOARES,SONIA MARIA TEIXEIRA SOARES,43.99999999999999
TACIANA CORREIA SILVA,TACIANA CORREIA SILVA,186.00000000000003
MARIA LIGIA MININ DE LINS,MARIA LIGIA MININ DE LINS,662.0
ANTONIO NELSON OLIVEIRA DE AZEVEDO,ANTONIO NELSON OLIVEIRA DE AZEVEDO,5836.000000000004
JOSÉ REGIS BARROS CAVALCANTE,JOSÉ REGIS BARROS CAVALCANTE,13986.0
LUCAS COSTA MOREIRA CESAR BARBOSA,LUCAS COSTA MOREIRA CESAR BARBOSA,4394.0
MAURÍCIO QUINTELLA MALTA LESSA,MAURÍCIO QUINTELLA MALTA LESSA,76706.00000000003
NIVALDO FERREIRA DE ALBUQUERQUE NETO,NIVALDO FERREIRA DE ALBUQUERQUE NETO,66910.0
EDSON MAIA NOBRE DE ABREU,EDSON MAIA NOBRE DE ABREU,1901.0000000000002
FLAVIO HENRIQUE CATÃO NOGUEIRA,FLAVIO HENRIQUE CATÃO NOGUEIRA,709.0000000000002
JOSÉ FRANCISCO DE LIMA,JOSÉ FRANCISCO DE LIMA,2273.000000000001
MARCOS ANTÔNIO VIEIRA DA SILVA,MARCOS ANTÔNIO VIEIRA DA SILVA,1519.0000000000005
ARTHUR CESAR PEREIRA DE LIRA,ARTHUR CESAR PEREIRA DE LIRA,98230.99999999999
JOSE JULIO DE ALMEIDA FILHO,JOSE JULIO DE ALMEIDA FILHO,8595.999999999996
MARIA FATIMA GALINA FORTES FERREIRA SANTIAGO,MARIA FATIMA GALINA FORTES FERREIRA SANTIAGO,15383.999999999995
WELLINGTON RODRIGUES FRAGOSO,WELLINGTON RODRIGUES FRAGOSO,3517.0000000000027
JOÃO HENRIQUE HOLANDA CALDAS,JOÃO HENRIQUE HOLANDA CALDAS,135928.99999999994
AUDINEIDE SILVA CAVALCANTE,AUDINEIDE SILVA CAVALCANTE,37.99999999999999
CRISTIANE MARQUES SAMPAIO,CRISTIANE MARQUES SAMPAIO,173.0
ROSEANE CAVALCANTE DE FREITAS,ROSEANE CAVALCANTE DE FREITAS,27116.000000000007
JOSÉ JERÔNIMO DE FARIAS NETO,JOSÉ JERÔNIMO DE FARIAS NETO,758.0000000000003
RONALDO AUGUSTO LESSA SANTOS,RONALDO AUGUSTO LESSA SANTOS,88124.99999999996
CARLOS ALBERTO DA SILVA,CARLOS ALBERTO DA SILVA,271.0000000000001
MARIA APARECIDA GERMANO DOS SANTOS,MARIA APARECIDA GERMANO DOS SANTOS,679.9999999999998
ROSIETE GOIS RAMOS,ROSIETE GOIS RAMOS,857.0000000000001
FERNANDO ANTÔNIO MACEDO HOLANDA,FERNANDO ANTÔNIO MACEDO HOLANDA,14553.000000000007
PAULO FERNANDO DOS SANTOS,PAULO FERNANDO DOS SANTOS,53284.00000000004
JOÃO JOSÉ PEREIRA DE LYRA,JOÃO JOSÉ PEREIRA DE LYRA,102.00000000000001
ROBERTO CARLOS TEIXEIRA GOMES,ROBERTO CARLOS TEIXEIRA GOMES,1685.0
ANTONIO CARLOS RAMOS,ANTONIO CARLOS RAMOS,5027.000000000001
IVON BERTO TIBURCIO DE LIMA,IVON BERTO TIBURCIO DE LIMA,6365.999999999997
GIVALDO DE SÁ GOUVEIA CARIMBÃO,GIVALDO DE SÁ GOUVEIA CARIMBÃO,82582.00000000004
JAMISON RODRIGUES DA SILVA,JAMISON RODRIGUES DA SILVA,1576.9999999999995
ALEXANDRE MURTA DE ARAÚJO ROCHA,ALEXANDRE MURTA DE ARAÚJO ROCHA,3782.9999999999995
CARLOS EUGÊNIO LESSA DE AZEVEDO SAMPAIO,CARLOS EUGÊNIO LESSA DE AZEVEDO SAMPAIO,10307.0
FRANCISCO DE SOUZA IRMÃO,FRANCISCO DE SOUZA IRMÃO,4798.000000000001
HEMERSON CASADO GAMA,HEMERSON CASADO GAMA,15101.999999999987
MARIA DE FÁTIMA DOS SANTOS,MARIA DE FÁTIMA DOS SANTOS,281.00000000000006
MARX BELTRÃO LIMA SIQUEIRA,MARX BELTRÃO LIMA SIQUEIRA,123317.00000000004
PEDRO RODRIGUES GAIA NETO,PEDRO RODRIGUES GAIA NETO,3864.000000000002
VENANCIO DOS ANJOS TELES,VENANCIO DOS ANJOS TELES,3354.0000000000014
JORGE VI LAMENHA LINS,JORGE VI LAMENHA LINS,8515.000000000007
VANILDO RUFINO DOS SANTOS,VANILDO RUFINO DOS SANTOS,4169.999999999998
ROGERIO AUTO TEOFILO,ROGERIO AUTO TEOFILO,47096.99999999996
PEDRO TORRES BRANDÃO VILELA,PEDRO TORRES BRANDÃO VILELA,119581.99999999996
MARCOS ANTONIO FERREIRA NUNES,MARCOS ANTONIO FERREIRA NUNES,5280.000000000004
CLIUTON SANTOS,CLIUTON SANTOS,425.00000000000017
ZEDEQUIAS ALVES RIBEIRO,ZEDEQUIAS ALVES RIBEIRO,1767.9999999999995
MARIA DO ROSÁRIO BARBOZA DA SILVA,MARIA DO ROSÁRIO BARBOZA DA SILVA,205.99999999999994
GESIEL ANTÔNIO DE OLIVEIRA,GESIEL ANTÔNIO DE OLIVEIRA,2776.0
JAILTON SANTOS COSTA,JAILTON SANTOS COSTA,3227.0000000000014
MEIRE ROSE NUNES ALVES,MEIRE ROSE NUNES ALVES,80.00000000000003
ADERVAL ROCHA TENÓRIO,ADERVAL ROCHA TENÓRIO,19392.000000000015
JULIO CESAR MARTINS DE CERQUEIRA,JULIO CESAR MARTINS DE CERQUEIRA,2189.9999999999995
CLAUDIANE PINHEIRO ARAÚJO,CLAUDIANE PINHEIRO ARAÚJO,1813.9999999999995
WODISON LOPES SILVA,WODISON LOPES SILVA,31.0
ALBERTO SAMUEL ALCOLUMBRE TOBELEM,ALBERTO SAMUEL ALCOLUMBRE TOBELEM,3843.000000000001
LUIZ CARLOS GOMES DOS SANTOS JUNIOR,LUIZ CARLOS GOMES DOS SANTOS JUNIOR,9666.999999999996
JOSE ANDRE DA SILVA BALIEIRO,JOSE ANDRE DA SILVA BALIEIRO,210.00000000000003
SEBASTIÃO FERREIRA DA ROCHA,SEBASTIÃO FERREIRA DA ROCHA,7299.999999999996
DALCILENE ANDRADE DE SOUSA,DALCILENE ANDRADE DE SOUSA,241.00000000000009
WELLINGTON DE SOUZA GOES,WELLINGTON DE SOUZA GOES,738.9999999999998
CLESIO CASTRO DO CARMO,CLESIO CASTRO DO CARMO,1378.9999999999995
VALCINETE FARIAS SANTANA,VALCINETE FARIAS SANTANA,1748.0000000000002
WALTER MONTEIRO BENATHAR,WALTER MONTEIRO BENATHAR,1652.9999999999998
LUCAS ABRAHAO ROSA CEZARIO DE ALMEIDA,LUCAS ABRAHAO ROSA CEZARIO DE ALMEIDA,7278.000000000001
LEONETI DOS SANTOS COSTA,LEONETI DOS SANTOS COSTA,2018.9999999999993
RAIMUNDO LAESTE SENA LIMA,RAIMUNDO LAESTE SENA LIMA,145.99999999999997
MIRAELSON COUTINHO TEIXEIRA ALVES,MIRAELSON COUTINHO TEIXEIRA ALVES,1824.0000000000002
CONCEIÇÃO CORREA MEDEIROS,CONCEIÇÃO CORREA MEDEIROS,7443.000000000002
GUARABICHABA MARTINS FERREIRA,GUARABICHABA MARTINS FERREIRA,262.99999999999994
EDUARDO BRASIL DANTAS,EDUARDO BRASIL DANTAS,296.00000000000006
ANTÔNIO ROBERTO RODRIGUES GÓES DA SILVA,ANTÔNIO ROBERTO RODRIGUES GÓES DA SILVA,22133.99999999999
ALDICLEIA LIRA GÓES,ALDICLEIA LIRA GÓES,30.0
JOSÉ LUIZ DA SILVA FERREIRA,JOSÉ LUIZ DA SILVA FERREIRA,992.0000000000003
MARIZETE GÓES DE MAGALHÃES,MARIZETE GÓES DE MAGALHÃES,1324.0
VANDA CHERFEN DE SOUZA,VANDA CHERFEN DE SOUZA,220.99999999999997
IRACELIA BARBOSA RODRIGUES,IRACELIA BARBOSA RODRIGUES,166.99999999999997
ALISON DIEGO DOS SANTOS PINHEIRO,ALISON DIEGO DOS SANTOS PINHEIRO,5947.000000000001
AMARILDO PORTO ARAÚJO,AMARILDO PORTO ARAÚJO,361.9999999999999
EURICELIA MELO CARDOSO,EURICELIA MELO CARDOSO,5714.999999999996
FÁTIMA LÚCIA PELAES,FÁTIMA LÚCIA PELAES,17542.00000000001
HILTON JOSE DA SILVA ALENCAR,HILTON JOSE DA SILVA ALENCAR,143.0
JACI ALMEIDA SIQUEIRA,JACI ALMEIDA SIQUEIRA,370.9999999999999
LUIZ GIONILSON PINHEIRO BORGES,LUIZ GIONILSON PINHEIRO BORGES,18709.000000000015
MARIA DE NAZARÉ DIAS FERREIRA,MARIA DE NAZARÉ DIAS FERREIRA,18.999999999999996
TELMA ADRIANA NERY PAIVA,TELMA ADRIANA NERY PAIVA,9247.000000000005
ALLAN ROSAS SALES,ALLAN ROSAS SALES,3093.0000000000023
JOSE ARNOUDO ALVES DE AMORIM,JOSE ARNOUDO ALVES DE AMORIM,764.9999999999998
DENISE APARECIDA MORELLI RIBEIRO,DENISE APARECIDA MORELLI RIBEIRO,80.00000000000003
PATRICIA LIMA FERRAZ,PATRICIA LIMA FERRAZ,9678.000000000007
AGORD DE MATOS PINTO,AGORD DE MATOS PINTO,1598.0
AGUIDA BARRIGA DA SILVA,AGUIDA BARRIGA DA SILVA,971.9999999999999
MARCOS JOSE REATEGUI SOUZA,MARCOS JOSE REATEGUI SOUZA,12485.0
RONALDO VITORIA FAGUNDES,RONALDO VITORIA FAGUNDES,541.0000000000001
JULIAM EDUARDO HOLANDA SOARES,JULIAM EDUARDO HOLANDA SOARES,885.9999999999998
ALZENIR DE SOUZA SANTOS,ALZENIR DE SOUZA SANTOS,361.9999999999999
ANTONIO RAIMUNDO BLANC DOS SANTOS,ANTONIO RAIMUNDO BLANC DOS SANTOS,755.0000000000002
CAMILO OLIVEIRA DE SOUZA,CAMILO OLIVEIRA DE SOUZA,629.0000000000001
EVANDRO COSTA GAMA,EVANDRO COSTA GAMA,3530.9999999999995
MANOEL DO NASCIMENTO CAMARA SOUZA,MANOEL DO NASCIMENTO CAMARA SOUZA,1412.0000000000005
MARIA DO PERPETUO SOCORRO DE ARAUJO MODESTO,MARIA DO PERPETUO SOCORRO DE ARAUJO MODESTO,1972.0
EDUARDO SEABRA DA COSTA,EDUARDO SEABRA DA COSTA,2127.0000000000005
JOZIANE ARAUJO NASCIMENTO ROCHA,JOZIANE ARAUJO NASCIMENTO ROCHA,10007.000000000005
JORIELSON BRITO NASCIMENTO,JORIELSON BRITO NASCIMENTO,4818.000000000001
ANTONIO LUIZ COUTINHO MARQUES,ANTONIO LUIZ COUTINHO MARQUES,370.9999999999999
REGIANE GURGEL MENEZES MEDEIROS,REGIANE GURGEL MENEZES MEDEIROS,61.99999999999999
FRANCISCO ODILON FILHO,FRANCISCO ODILON FILHO,7564.0
FRAN SOARES NASCIMENTO JUNIOR,FRAN SOARES NASCIMENTO JUNIOR,0.0
JURANDIL DOS SANTOS JUAREZ,JURANDIL DOS SANTOS JUAREZ,8515.000000000007
PEDRO LOURENÇO DA COSTA NETO,PEDRO LOURENÇO DA COSTA NETO,3565.0000000000027
ALDRIN NUNES TORRINHA,ALDRIN NUNES TORRINHA,6755.999999999995
MARCIA NAZARÉ FARIAS PINHEIRO,MARCIA NAZARÉ FARIAS PINHEIRO,452.0000000000001
OFIRNEY DA CONCEIÇAO SADALA,OFIRNEY DA CONCEIÇAO SADALA,10285.999999999995
ELIZOMAR PEREIRA ALVES,ELIZOMAR PEREIRA ALVES,521.0000000000002
SIDIANE RIBEIRO SOBRINHO,SIDIANE RIBEIRO SOBRINHO,64.99999999999997
ADIMIRÇO DE ALMEIDA RAMOS,ADIMIRÇO DE ALMEIDA RAMOS,889.0
ZILMA CORREA BALIEIRO DOS SANTOS,ZILMA CORREA BALIEIRO DOS SANTOS,10478.000000000005
EURISON DE ANDRADE DA SILVA,EURISON DE ANDRADE DA SILVA,5291.000000000003
ARLITA SÁ DA SILVA,ARLITA SÁ DA SILVA,0.0
MESSIAS REIS DA SILVA,MESSIAS REIS DA SILVA,14.0
ANDRÉ DOS SANTOS ABDON,ANDRÉ DOS SANTOS ABDON,13798.000000000011
PAULA DE CARVALHO BASTONE,PAULA DE CARVALHO BASTONE,253.99999999999991
RAIMUNDO NONATO CÔRTES COSTA,RAIMUNDO NONATO CÔRTES COSTA,751.0000000000001
ANTONIO DE DEUS NUNES DOS SANTOS,ANTONIO DE DEUS NUNES DOS SANTOS,7918.0
FABIANA FERREIRA BARROS,FABIANA FERREIRA BARROS,16.0
JANETE MARIA GÓES CAPIBERIBE,JANETE MARIA GÓES CAPIBERIBE,21107.999999999985
ALVARO DE OLIVEIRA CORREA JUNIOR,ALVARO DE OLIVEIRA CORREA JUNIOR,1230.0000000000005
EDILSON VIEIRA ROCHA,EDILSON VIEIRA ROCHA,4362.0
EMERSON SILVEIRA DA SILVA,EMERSON SILVEIRA DA SILVA,719.0000000000001
MARCIVANIA DO SOCORRO DA ROCHA FLEXA,MARCIVANIA DO SOCORRO DA ROCHA FLEXA,16161.999999999993
MARCOS ROBERTO MARQUES DA SILVA,MARCOS ROBERTO MARQUES DA SILVA,6563.000000000003
MARIA DALVA DE SOUZA FIGUEIREDO,MARIA DALVA DE SOUZA FIGUEIREDO,11593.000000000004
EVANDRO COSTA MILHOMEN,EVANDRO COSTA MILHOMEN,8706.999999999993
JOSÉ CARLOS TAVARES CARVALHO,JOSÉ CARLOS TAVARES CARVALHO,2461.000000000001
EUDES GOMES DA COSTA,EUDES GOMES DA COSTA,1698.0000000000007
FRANCISCO CRISTIANO LUCENA,FRANCISCO CRISTIANO LUCENA,458.00000000000006
IZAIAS JOSE CRUZ CUNHA,IZAIAS JOSE CRUZ CUNHA,2220.0
JOSIVAN DOS SANTOS SOUSA,JOSIVAN DOS SANTOS SOUSA,442.0
RILDO FREDERICO FERREIRA,RILDO FREDERICO FERREIRA,201.99999999999997
UBIRANILDO DA SILVA MACEDO,UBIRANILDO DA SILVA MACEDO,2357.000000000001
WALDIR PIRES BITTENCOURT,WALDIR PIRES BITTENCOURT,238.00000000000009
JAILSON GILSON SOARES NUNES,JAILSON GILSON SOARES NUNES,53.00000000000001
KELLE CRISTIANE COSTA DAMASCENO,KELLE CRISTIANE COSTA DAMASCENO,33.99999999999999
CLEONICE DE MORAES BARBOSA,CLEONICE DE MORAES BARBOSA,6.999999999999998
MARIA ROSETE DANTAS FERREIRA,MARIA ROSETE DANTAS FERREIRA,29.000000000000004
PAULO VICTOR PENAFORT MENDES,PAULO VICTOR PENAFORT MENDES,572.0000000000002
DAMIANA AMORIM CABRAL,DAMIANA AMORIM CABRAL,652.0
MARCOS SERGIO ROTTA,MARCOS SERGIO ROTTA,117954.99999999997
GEDEAO TIMOTEO AMORIM,GEDEAO TIMOTEO AMORIM,62999.00000000004
MESSIAS WILSON DE MEDEIROS CURSINO,MESSIAS WILSON DE MEDEIROS CURSINO,16088.999999999995
ANA MARIA DOS SANTOS BRITO,ANA MARIA DOS SANTOS BRITO,768.0000000000003
RAIMUNDO SABINO CASTELO BRANCO MAUES,RAIMUNDO SABINO CASTELO BRANCO MAUES,69708.00000000004
MARIA DA CONCEIÇÃO SAMPAIO MOURA,MARIA DA CONCEIÇÃO SAMPAIO MOURA,71877.99999999996
JOSE NILMAR ALVES DE OLIVEIRA,JOSE NILMAR ALVES DE OLIVEIRA,48281.0
NUBIA REGINA SOARES RODRIGUES,NUBIA REGINA SOARES RODRIGUES,32.0
HISSA NAGIB ABRAHÃO FILHO,HISSA NAGIB ABRAHÃO FILHO,113646.00000000001
ERONILDO BRAGA BEZERRA,ERONILDO BRAGA BEZERRA,58766.00000000002
MARCELO SOARES DE OLIVEIRA,MARCELO SOARES DE OLIVEIRA,520.0
JOÃO PEDRO GONÇALVES DA COSTA,JOÃO PEDRO GONÇALVES DA COSTA,46926.99999999997
JOSE DOS SANTOS NASCIMENTO,JOSE DOS SANTOS NASCIMENTO,1673.0000000000002
MIGUEL DAVID FABIANO PERRONE,MIGUEL DAVID FABIANO PERRONE,1377.0000000000002
IVONE MARIA DO NASCIMENTO PERRONE,IVONE MARIA DO NASCIMENTO PERRONE,35.99999999999999
CRISTIANE AMARAL SALES TELLES,CRISTIANE AMARAL SALES TELLES,9775.000000000005
FRANCISCO NAZARENO CORREA NEVES,FRANCISCO NAZARENO CORREA NEVES,1475.0
STONES DA COSTA MACHADO,STONES DA COSTA MACHADO,2426.0
RONYERVERSON PEREIRA SIQUEIRA,RONYERVERSON PEREIRA SIQUEIRA,3594.9999999999995
SEBASTIÃO SOUZA QUEIROZ,SEBASTIÃO SOUZA QUEIROZ,782.9999999999998
INALDO CRUZ PLACIDO,INALDO CRUZ PLACIDO,0.0
MARCELO FURTADO MACHADO LEITÃO,MARCELO FURTADO MACHADO LEITÃO,541.9999999999999
KATIA CILENE DOS SANTOS SILVA,KATIA CILENE DOS SANTOS SILVA,2033.0000000000002
SARAH KALILAH FERNANDES FURTADO,SARAH KALILAH FERNANDES FURTADO,2883.0000000000014
LUIS FELIPE SILVA DE SOUZA,LUIS FELIPE SILVA DE SOUZA,18949.999999999985
MAURICIO WILKER DE AZEVEDO BARRETO,MAURICIO WILKER DE AZEVEDO BARRETO,16064.000000000007
LUIZ GONZAGA OLIVEIRA DE MORAES,LUIZ GONZAGA OLIVEIRA DE MORAES,2924.0000000000014
GILMAR EDUARDO COSTA DO COUTO,GILMAR EDUARDO COSTA DO COUTO,2792.0000000000014
PAUDERNEY TOMAZ AVELINO,PAUDERNEY TOMAZ AVELINO,103903.99999999993
MONICA GOMES DA SILVA PITANGA,MONICA GOMES DA SILVA PITANGA,1442.9999999999998
ALONSO OLIVEIRA DE SOUZA,ALONSO OLIVEIRA DE SOUZA,6460.999999999997
MAYSA COSTA DA SILVA,MAYSA COSTA DA SILVA,584.0000000000002
ALFREDO PEREIRA DO NASCIMENTO,ALFREDO PEREIRA DO NASCIMENTO,120060.00000000006
JOSE ADALBERTO DA SILVA,JOSE ADALBERTO DA SILVA,0.0
WALFRAN DE SOUZA TORRES,WALFRAN DE SOUZA TORRES,5246.999999999999
VILMA FLORENÇO QUEIROZ,VILMA FLORENÇO QUEIROZ,5337.000000000004
ARTHUR VIRGILIO DO CARMO RIBEIRO BISNETO,ARTHUR VIRGILIO DO CARMO RIBEIRO BISNETO,250916.00000000012
ATILA SIDNEY LINS DE ALBUQUERQUE,ATILA SIDNEY LINS DE ALBUQUERQUE,89452.99999999996
CARLOS ALBERTO CAVALCANTE DE SOUZA,CARLOS ALBERTO CAVALCANTE DE SOUZA,53019.99999999998
GUARACY DE JESUS DIAS REBELO,GUARACY DE JESUS DIAS REBELO,2426.0
SILAS CAMARA,SILAS CAMARA,166281.0
CARLOS RENÊ DE SOUZA FERNANDES,CARLOS RENÊ DE SOUZA FERNANDES,49275.00000000001
STANLEY PINHEIRO BRAGA,STANLEY PINHEIRO BRAGA,5157.000000000004
DEUSA RAMIRO LOPES,DEUSA RAMIRO LOPES,170.99999999999994
ROBERTO AUGUSTO RODRIGUES CAMPAINHA,ROBERTO AUGUSTO RODRIGUES CAMPAINHA,408.00000000000017
REGINA CÉLIA SICSU DOS SANTOS,REGINA CÉLIA SICSU DOS SANTOS,196.0
AUXILIADORA DE SOUZA SANTOS,AUXILIADORA DE SOUZA SANTOS,672.0
SHIRNEILA PALHETA FREITAS,SHIRNEILA PALHETA FREITAS,577.0000000000001
ALEXANDRE SIMÕES DE SOUZA,ALEXANDRE SIMÕES DE SOUZA,1447.9999999999998
ADAMOR SANTANA LIBERAL DE JESUS,ADAMOR SANTANA LIBERAL DE JESUS,479.0
JOSÉ ROBERTO DOS SANTOS,JOSÉ ROBERTO DOS SANTOS,651.0000000000001
FERNANDO JOSÉ RODRIGUES LOBATO,FERNANDO JOSÉ RODRIGUES LOBATO,397.0
OSMARINO ANTONIO BUENO DE CASTRO,OSMARINO ANTONIO BUENO DE CASTRO,247.00000000000009
BENILDES DOS SANTOS SILVA,BENILDES DOS SANTOS SILVA,162.0
ANDERSON JOSE RAZORI,ANDERSON JOSE RAZORI,2932.9999999999995
GILBERTO HILARIO DA SILVA,GILBERTO HILARIO DA SILVA,299.9999999999999
LAURI DA SILVA GUERREIRO,LAURI DA SILVA GUERREIRO,760.0000000000002
DARCY GRAÇA VALERIO DE SOUSA,DARCY GRAÇA VALERIO DE SOUSA,390.0
RICARDO ZIMA AGUIAR,RICARDO ZIMA AGUIAR,655.9999999999997
RODRIGO FROTA,RODRIGO FROTA,1620.0000000000002
DARLENE MAQUINÉ DOS SANTOS,DARLENE MAQUINÉ DOS SANTOS,724.0
VALDIRENE PICANÇO DE CASTRO,VALDIRENE PICANÇO DE CASTRO,364.0
CLEISIANE OLIVEIRA DA SILVA,CLEISIANE OLIVEIRA DA SILVA,206.99999999999997
LUIZ ANTONIO CAMPOS CORREA,LUIZ ANTONIO CAMPOS CORREA,5584.999999999998
ALCINEIDE PEREIRA DA SILVA,ALCINEIDE PEREIRA DA SILVA,109.99999999999997
GABRIELA PROTÁSIO MOTA,GABRIELA PROTÁSIO MOTA,7262.999999999998
GILDASIO DE CERQUEIRA DALTRO FILHO,GILDASIO DE CERQUEIRA DALTRO FILHO,304.00000000000006
JAMERSON LUIZ GONÇALVES DOS SANTOS,JAMERSON LUIZ GONÇALVES DOS SANTOS,5713.000000000005
VALDECI BARBOSA BRITO,VALDECI BARBOSA BRITO,26.999999999999996
JOSÉ RUDIVAL SANTOS DE OLIVEIRA,JOSÉ RUDIVAL SANTOS DE OLIVEIRA,844.0000000000001
GILDASIO CARVALHO DA CUNHA,GILDASIO CARVALHO DA CUNHA,2288.0000000000005
CHRISTIANO PABLO ALVES NEIVA,CHRISTIANO PABLO ALVES NEIVA,595.0000000000001
PAULA CRISTINA DE SIQUEIRA PINHEIRO,PAULA CRISTINA DE SIQUEIRA PINHEIRO,155.99999999999994
MAGNO OLIVEIRA ROCHA,MAGNO OLIVEIRA ROCHA,1120.9999999999998
ALANA MARIA FERREIRA BISPO,ALANA MARIA FERREIRA BISPO,853.9999999999998
FRANDERRAK DOS SANTOS MASCARENHAS,FRANDERRAK DOS SANTOS MASCARENHAS,3208.9999999999977
JOILSON BARROS SANTOS,JOILSON BARROS SANTOS,1523.0000000000007
UILSON MAGALHAES SILVA,UILSON MAGALHAES SILVA,1330.0000000000005
DAMIÃO DOS SANTOS,DAMIÃO DOS SANTOS,1943.9999999999995
JOSÉ WELLINGTON ALVES DOS SANTOS,JOSÉ WELLINGTON ALVES DOS SANTOS,1034.9999999999998
AUGUSTO CESAR RIBEIRO JAMBEIRO,AUGUSTO CESAR RIBEIRO JAMBEIRO,0.0
EDVANIA SANTOS MOURA,EDVANIA SANTOS MOURA,43.99999999999999
SIDINEA ALMEIDA PEDREIRA VRBATA,SIDINEA ALMEIDA PEDREIRA VRBATA,2511.9999999999995
ZILMAR ALVERITA DA SILVA,ZILMAR ALVERITA DA SILVA,4780.999999999998
GUILHERME GOMES DE VASCONCELLOS,GUILHERME GOMES DE VASCONCELLOS,398.9999999999999
MARCIO VINICIUS FEITOSA RAMOS,MARCIO VINICIUS FEITOSA RAMOS,3527.999999999998
MAIARA SANTOS DE CARVALHO,MAIARA SANTOS DE CARVALHO,80.00000000000003
MARIA FERREIRA DE SOUZA,MARIA FERREIRA DE SOUZA,61.00000000000001
CLEIDE MERCÊS COUTINHO,CLEIDE MERCÊS COUTINHO,844.0000000000001
REINALDO DA CRUZ MARTINS,REINALDO DA CRUZ MARTINS,684.0000000000002
ANTONIA FERREIRA DE SOUSA NETA,ANTONIA FERREIRA DE SOUSA NETA,304.00000000000006
SOLANGE SILVA DE JESUS,SOLANGE SILVA DE JESUS,82.00000000000003
NEWTON JOÃO TEIXEIRA JUNIOR,NEWTON JOÃO TEIXEIRA JUNIOR,3598.999999999998
ELIEIDE MACIEL DE OLIVEIRA BORGES,ELIEIDE MACIEL DE OLIVEIRA BORGES,96.0
ANTONIO LUIZ PARANHOS RIBEIRO LEITE DE BRITO,ANTONIO LUIZ PARANHOS RIBEIRO LEITE DE BRITO,159839.99999999988
BENITO DA GAMA SANTOS,BENITO DA GAMA SANTOS,71372.00000000003
CESAR JOAO MARTINS PERCO,CESAR JOAO MARTINS PERCO,1299.0
FELIX DE ALMEIDA MENDONÇA JUNIOR,FELIX DE ALMEIDA MENDONÇA JUNIOR,130582.99999999999
FLÁVIA GHISSONI DOS SANTOS,FLÁVIA GHISSONI DOS SANTOS,1164.9999999999998
NALVA SOUZA SAMPAIO,NALVA SOUZA SAMPAIO,1384.0000000000002
NIVALDO TEIXEIRA LIMA FILHO,NIVALDO TEIXEIRA LIMA FILHO,1560.0000000000005
ODIOSVALDO BOMFIM VIGAS,ODIOSVALDO BOMFIM VIGAS,12242.000000000004
REGINA PATRÍCIA COSTA MORELLI DOS SANTOS,REGINA PATRÍCIA COSTA MORELLI DOS SANTOS,693.9999999999999
SEVERIANO ALVES DE SOUZA,SEVERIANO ALVES DE SOUZA,28275.999999999996
AFONSO BANDEIRA FLORENCE,AFONSO BANDEIRA FLORENCE,82661.00000000003
ALICE MAZZUCO PORTUGAL,ALICE MAZZUCO PORTUGAL,72681.99999999997
AMAURI SANTOS TEIXEIRA,AMAURI SANTOS TEIXEIRA,50681.000000000044
DANIEL GOMES DE ALMEIDA,DANIEL GOMES DE ALMEIDA,135382.00000000003
DAVIDSON DE MAGALHÃES SANTOS,DAVIDSON DE MAGALHÃES SANTOS,65170.99999999998
ELISANGELA DOS SANTOS ARAUJO,ELISANGELA DOS SANTOS ARAUJO,31503.000000000015
EMILIANO JOSÉ DA SILVA FILHO,EMILIANO JOSÉ DA SILVA FILHO,63623.99999999995
GERALDO SIMÕES DE OLIVEIRA,GERALDO SIMÕES DE OLIVEIRA,55636.00000000002
HENRIQUE TAVARES BARREIROS,HENRIQUE TAVARES BARREIROS,3944.999999999997
JORGE JOSÉ SANTOS PEREIRA SOLLA,JORGE JOSÉ SANTOS PEREIRA SOLLA,125159.0
JOSIAS GOMES DA SILVA,JOSIAS GOMES DA SILVA,98870.99999999993
JOSÉ LUIZ RESSURREIÇÃO DOS SANTOS,JOSÉ LUIZ RESSURREIÇÃO DOS SANTOS,0.0
LUIZ ALBERTO SILVA DOS SANTOS,LUIZ ALBERTO SILVA DOS SANTOS,48530.99999999999
LUIZ CARLOS CAETANO,LUIZ CARLOS CAETANO,125862.00000000001
MOEMA ISABEL PASSOS GRAMACHO,MOEMA ISABEL PASSOS GRAMACHO,81414.00000000001
NELSON VICENTE PORTELA PELLEGRINO,NELSON VICENTE PORTELA PELLEGRINO,111251.99999999991
ROBINSON SANTOS ALMEIDA,ROBINSON SANTOS ALMEIDA,64265.000000000015
VALMIR CARLOS DA ASSUNÇÃO,VALMIR CARLOS DA ASSUNÇÃO,123283.99999999994
WALDENOR ALVES PEREIRA FILHO,WALDENOR ALVES PEREIRA FILHO,114965.00000000009
YULO OITICICA PEREIRA,YULO OITICICA PEREIRA,56506.999999999985
EDSON SAMPAIO PIMENTA,EDSON SAMPAIO PIMENTA,51676.00000000001
FERNANDO DANTAS TORRES,FERNANDO DANTAS TORRES,66215.00000000003
JOSÉ NUNES SOARES,JOSÉ NUNES SOARES,105776.00000000006
JOSÉ CARLOS LEÃO DE ARAUJO,JOSÉ CARLOS LEÃO DE ARAUJO,72012.99999999996
JUSMARI TEREZINHA DE SOUZA OLIVEIRA,JUSMARI TEREZINHA DE SOUZA OLIVEIRA,56206.00000000004
PAULO SERGIO PARANHOS DE MAGALHÃES,PAULO SERGIO PARANHOS DE MAGALHÃES,77045.00000000001
JOÃO CARLOS PAOLILO BACELAR FILHO,JOÃO CARLOS PAOLILO BACELAR FILHO,111642.99999999997
JOSÉ ALVES ROCHA,JOSÉ ALVES ROCHA,101663.00000000009
PEDRO ALCANTARA DE SOUZA,PEDRO ALCANTARA DE SOUZA,16694.00000000001
CARLOS FELIPE VAZQUEZ DE SOUZA LEÃO,CARLOS FELIPE VAZQUEZ DE SOUZA LEÃO,125605.00000000009
JOÃO HONORATO NASCIMENTO CASTRO,JOÃO HONORATO NASCIMENTO CASTRO,6960.000000000005
MÁRIO SÍLVIO MENDES NEGROMONTE JÚNIOR,MÁRIO SÍLVIO MENDES NEGROMONTE JÚNIOR,169214.99999999988
ROBERTO PEREIRA DE BRITTO,ROBERTO PEREIRA DE BRITTO,110822.00000000003
RONALDO CARLETTO,RONALDO CARLETTO,148628.00000000006
ÉRICA BATISTA DE SANTANA,ÉRICA BATISTA DE SANTANA,3245.9999999999973
DILEUZA DE SOUZA PINTO,DILEUZA DE SOUZA PINTO,52.00000000000001
TABATA PRISCILA SILVA CERQUEIRA,TABATA PRISCILA SILVA CERQUEIRA,117.00000000000004
SERGIO LUIS LACERDA BRITO,SERGIO LUIS LACERDA BRITO,83657.99999999999
JOSE CARLOS LELIS COSTA,JOSE CARLOS LELIS COSTA,6181.999999999996
